{"aip":"1.0","biscuit_root_pubkey":"c8efd3cbfb88ae70d094f1b68da5587a65b5bc05d1aedaa7f03832fbf64ab63c","delegation":{"mode":"chained"},"document_signature":{"alg":"Ed25519","kid":"biscuit-root-1","signature":"ecc0770634143e87ddda5b3c5aa346c176ebd8732d06100202964b503548f98f0be1a00159ffe42ef52f2cda2878e05e84e42e6d9dd48275837c4e0291c8b40f"},"expires":"2027-05-07T00:00:00Z","id":"aip:web:wakir.dev/tv-w-3-issuer-1-0","name":"tv-w-3-issuer-1-0","protocols":["wirelang/0.1"],"public_keys":[{"alg":"Ed25519","key_hex":"c8efd3cbfb88ae70d094f1b68da5587a65b5bc05d1aedaa7f03832fbf64ab63c","kid":"biscuit-root-1","purpose":"biscuit-root","validafter":"2026-05-07T00:00:00Z","validuntil":null}],"verification_methods":[{"controller":"did:web:wakir.dev:tv-w-3-issuer-1-0","id":"did:web:wakir.dev:tv-w-3-issuer-1-0#keys-ed25519-1","publicKeyHex":"c8efd3cbfb88ae70d094f1b68da5587a65b5bc05d1aedaa7f03832fbf64ab63c","type":"Ed25519VerificationKey2020"}]}
